sentence,tag1,tag2,tag3,section,notes
"(7) With this, we observe that our two confidence intervals for the expected number of deaths in Chicago, one predicted with the lowest observed pollution values and the other predicted generally, do not overlap and are entirely separate",,,,,
The closest bounds have about a 6 person difference between them,,,,,
"Since they do not overlap, we can infer that lower average pollutant measurements, for PM10 and ozone pollutants, likely result in lower deaths per day in Chicago",,,,,
This is a crucial statement when understanding how pollutants affect expected deaths,,,,,
"We must also acknowledge that our expected deaths predicted with our lowest observed pollution values takes place during a time when the temperature is 70 degrees, or likely during the summer months",,,,,
By comparing this estimate generally to a prediction of expected deaths over all our months may lead to potentially skewed results due to seasonally dependent relationships with our response,,,,,
"We maintain that lower observations of average pollutants likely lead to lower death counts in Chicago, however more analysis should be done to bolster this claim independent of the season",,,,,
This is difficult since our pollution variables tend to vary with time as well,,,,,
Conclusion,,,,,
Prediction and Inference,,,,,
"(1) In this report we were able to model the expected number of deaths in Chicago using variables measuring pollution, temperature and time",,,,,
We were able to conclude with relative confidence that the number of deaths on any given day in Chicago is most associated with pollution over short time periods (1 week) as opposed to pollutant measurements on any particular day,,,,,
"We also found that the lagged affect of pollution is quite clear and benefits our resultant model significantly when compared to a model that does not use pollution measurements as variables, and we can generally say that there is a positive association with increased measurements of pollution and deaths",,,,,
"The variables that are most associated with deaths in Chicago, however, appear to be time and temperature",,,,,
"The pollutants that are most associated with deaths in Chicago are weekly averages of PM10 and ozone pollution, and sulfur dioxide is not found to be associated with deaths at all",,,,,
"To test their expected affect on deaths, we were able to compare our predicted death toll from our model for values of lowest observed average pollution to the average expected death toll generally, and were able to conclude that low average pollution values lead to low expected death tolls in Chicago",,,,,
"(3) While this relationship is potentially skewed by the time of year, we maintain this claim and suggest more analysis should be run, holding time or seasonality constant",,,,,
"This is a limitation of our study, and perhaps another model method would be appropriate to allow the inclusion of interaction terms",,,,,
"(2) We cannot say, generally, that lowering pollutants would cause lower death tolls because the data is purely observational, meaning the relationships observed are only associations and we did not have complete control over the factors in this data",,,,,
Works Consulted,,,,,
Prediction and Inference,,,,,
All lecture notes and demos on Canvas,,,,,
"Used for cyclic spline term reference: (""https://fromthebottomoftheheap.net/2014/05/09/modelling-seasonal-data-with-gam/"") (""https://stackoverflow.com/questions/54033437/error-in-gam-function-in-namesx-value-names-attribute-must-be-the-same-l"") As well as all the package help documentation",,,,,
,,,,,
